{
  "schema_version": "0.2",
  "problem_id": "example.sort-ints",
  "objective": "Return the sorted permutation of an integer list",
  "category": "algorithm",
  "inputs": [
    {
      "name": "cases.json",
      "sha256": "352b84777d8dd96ac9c0b3c170ecb2c7cca7fc2dbae41a1ec1ed4286fb2c43db"
    }
  ],
  "allowed_tools": [
    "python"
  ],
  "budget": {
    "compute_units": 100.0,
    "max_attempts": 8
  },
  "verification": {
    "method": "property_tests",
    "verifier_id": "property-tests",
    "verifier_version": "0.1.0",
    "criterion_sha256": "8873a37cfd746f1ce690919507b4b2a5afc675ddbc5a1dcbe1951d25fb48f73f",
    "required_trust": "V2"
  },
  "success_criteria": "All hidden and property tests pass",
  "depends_on": [],
  "provenance": {
    "source": "schemas/examples",
    "created_by": "frontier",
    "license": "Apache-2.0"
  },
  "difficulty": 0.1
}